{"body_reads":"0","deletion_policy":"GIT_DIFF_TOMBSTONE","discovery_manifest_digest":"aaf942e7700d6d728cc0bd5f1c9ffcf934dd9900f8130caee25b2743faa2dba8","fixture_digest":"75078444c9ab73896c862302da956cabe2b987f4d1d7e5011d2de1fa2e8306d6","git_head":"7c8b927a6168bc7757b13d064efdbe41c03a0e1c","history_policy":"GIT_OBJECT_HISTORY_RETAINED","identity_mapping":"ROOT_RELATIVE_POSIX_PATH","import_requested":false,"overlap_policy":"INCLUSIVE_PREVIOUS_WATERMARK","pagination":"CANONICAL_DECIMAL_PAGINATION","profile_digest":"ffd64b734704423bc967afdc9e358cc2c4af4ad05b7ac8c9c4b7e551ef499777","profile_version":"second-brain-me-wiki-source-profile-v1","promote_requested":false,"restart_policy":"REPLAY_AND_DEDUPE","retention_hours":"2160","revision_mapping":"GIT_BLOB_OID","row_order":"LEXICAL_CURSOR_ORDER","serve_requested":false,"source_mutation":false,"source_name":"me-wiki","source_root":"/Volumes/DevSpace/me-wiki","tracked_count":"17","tracked_tree":[{"mode":"100644","oid":"7b4af37446e5d1fa9fa90868800a1ad4310758c9","relative_path":"AGENT_RULES.md","stage":"0"},{"mode":"100644","oid":"19cf12d8e2b143900a256273666dcdea382f5716","relative_path":"INDEX.md","stage":"0"},{"mode":"100644","oid":"cac83afb77b69152b85d74a6502828b21cbf9309","relative_path":"faq/_template.md","stage":"0"},{"mode":"100644","oid":"df3ad9ad38c6dc17c5972d2b4851a56e7735ec18","relative_path":"identity/profile.md","stage":"0"},{"mode":"100644","oid":"c7e4e76f4d6ecae02538d0d444f4a0046e4760b2","relative_path":"ops/_template.md","stage":"0"},{"mode":"100644","oid":"e701358103a9e55fe2cfa8f02e09a4ff75b3a1ad","relative_path":"ops/repo-cleanup.md","stage":"0"},{"mode":"100644","oid":"ecaab5839717858e64a5c775f709ae10f81bdb84","relative_path":"people/_template.md","stage":"0"},{"mode":"100644","oid":"c0ad3a4b5e64e04c6d0c4014c6c307b5730becdc","relative_path":"principles/_template.md","stage":"0"},{"mode":"100644","oid":"75399335d80795fb07ecfcdc1362c7e9b683992b","relative_path":"principles/pricing.md","stage":"0"},{"mode":"100644","oid":"73e777c3c1baa1773aaebecca6dba5043823baeb","relative_path":"principles/prioritization.md","stage":"0"},{"mode":"100644","oid":"cdcb6938d5909ad5bbd78a3ba147ba644f73c0f1","relative_path":"principles/work-acceptance.md","stage":"0"},{"mode":"100644","oid":"4244a0cb198b2439f4535368054aee5cbf536042","relative_path":"projects/agentgauge.md","stage":"0"},{"mode":"100644","oid":"551f7d15634747a01f42b573e95e4ba54844961d","relative_path":"projects/blro-os.md","stage":"0"},{"mode":"100644","oid":"e6ea8ee43b14d117eca292656d371c18218e8c45","relative_path":"projects/jarvis-ai.md","stage":"0"},{"mode":"100644","oid":"ebee6ba4632779ad8da864b2bc193388f6ed6f99","relative_path":"projects/unified-db.md","stage":"0"},{"mode":"100644","oid":"ef0ab37f6c63d1f7e98756d56d65903e7f2c10c7","relative_path":"voice/_template.md","stage":"0"},{"mode":"100644","oid":"370fef8f9ce04545d5c853da5ac04267ddc14040","relative_path":"voice/customer-email.md","stage":"0"}],"tracked_tree_digest":"b162715a85e985710b34030abf036849a976cbaed525383b36ca1ae60e67369f","watermark_mapping":"GIT_HEAD_PLUS_MTIME_NS"}
